{
  "name": "Harry Potter",
  "contact": {
    "email": "harry.potter@example.com",
    "phone": "555-0900",
    "links": [
      "https://github.com/hpotter/wand-builder"
    ]
  },
  "education": [
    {
      "institution": "Hogwarts School",
      "degree": "N.E.W.T.",
      "field": "Defense Against the Dark Arts",
      "start_date": "September 1991",
      "end_date": "June 1998",
      "gpa": 3.8
    }
  ],
  "experience": [
    {
      "company": "Ministry of Magic",
      "title": "Auror",
      "start_date": "July 1998",
      "end_date": "Present",
      "bullets": [
        "Investigated dark magic threats.",
        "Created the 'Wand-Builder' simulation tool for training recruits."
      ]
    },
    {
      "company": "Hogwarts School",
      "title": "Guest Instructor",
      "start_date": "September 2002",
      "end_date": "June 2005",
      "bullets": [
        "Taught practical defense techniques to OWL students.",
        "Shared simulations from my project code repo https://github.com/hpotter/wand-builder for student use."
      ]
    }
  ],
  "projects": [
    {
      "name": "Wand-Builder",
      "description": "Simulation software for testing wand core properties under various conditions. Code is hosted at https://github.com/hpotter/wand-builder.",
      "tech_stack": [
        "Python",
        "Tkinter"
      ],
      "links": [
        "https://github.com/hpotter/wand-builder"
      ]
    }
  ],
  "skills": [
    "Defense",
    "Leadership",
    "Teaching"
  ],
  "open_source_contributions": []
}