{
  "name": "Evan Wright",
  "contact": {
    "email": "evan.wright@example.com",
    "phone": "555-0600",
    "links": [
      "https://github.com/evanwright"
    ]
  },
  "education": [
    {
      "institution": "University of Michigan",
      "degree": "BS in Software Engineering",
      "field": "",
      "start_date": "September 2017",
      "end_date": "May 2021",
      "gpa": 3.8
    }
  ],
  "experience": [
    {
      "company": "App Builders Inc",
      "title": "Junior Developer",
      "start_date": "June 2021",
      "end_date": "Present",
      "bullets": [
        "Maintained client web applications.",
        "Collaborated on 'Fast-Cache' middleware optimization."
      ]
    },
    {
      "company": "Freelance Contracting",
      "title": "Full Stack Contractor",
      "start_date": "December 2022",
      "end_date": "Present",
      "bullets": [
        "Engineered the 'Fast-Cache' middleware library for high-throughput node applications.",
        "Built responsive React dashboards for various clients."
      ]
    }
  ],
  "projects": [
    {
      "name": "Fast-Cache",
      "description": "High-throughput Redis-backed Node caching middleware.",
      "tech_stack": [
        "Node.js",
        "Redis",
        "TypeScript"
      ],
      "links": [
        "https://github.com/evanwright/fast-cache"
      ]
    }
  ],
  "skills": [
    "Node.js",
    "Redis",
    "React",
    "TypeScript"
  ],
  "open_source_contributions": []
}