{
  "name": "Iris West",
  "contact": {
    "email": "iris.west@example.com",
    "phone": "555-1000",
    "links": [
      "https://linkedin.com/in/iriswest"
    ]
  },
  "education": [
    {
      "institution": "Central City University",
      "degree": "Bachelor of Arts (BA)",
      "field": "Journalism",
      "start_date": "September 2011",
      "end_date": "June 2015",
      "gpa": 3.7
    },
    {
      "institution": "University Name",
      "degree": "Bachelor of Science (BSc)",
      "field": "Computer Science",
      "start_date": "September 2018",
      "end_date": "June 2022",
      "gpa": 3.9
    }
  ],
  "experience": [
    {
      "company": "Central City Picture News",
      "title": "Investigative Reporter",
      "start_date": "July 2015",
      "end_date": "Present",
      "bullets": [
        "Conducted interviews and wrote front-page articles on city incidents.",
        "Managed the digital newsroom archive transition."
      ]
    }
  ],
  "projects": [
    {
      "name": "Project Name",
      "description": "Short description of the project.",
      "tech_stack": [
        "Python",
        "Docker"
      ],
      "links": [
        "https://github.com/username/project"
      ]
    }
  ],
  "skills": [
    "Writing",
    "Editing",
    "SEO",
    "Research"
  ],
  "open_source_contributions": [
    {
      "repo": "example-news-archive",
      "pr_link": "https://github.com/exampleorg/news-archive/pull/2",
      "description": "Added a new feature to the news archive system, allowing for easier search and filtering of articles."
    }
  ]
}