{
  "name": "Diana Prince",
  "contact": {
    "email": "diana.prince@example.com",
    "phone": "555-0500",
    "links": [
      "https://github.com/dianaprince",
      "https://linkedin.com/in/dianaprince"
    ]
  },
  "education": [
    {
      "institution": "Oxford University",
      "degree": "Doctor of Philosophy",
      "field": "Archaeology",
      "start_date": "October 2010",
      "end_date": "June 2014",
      "gpa": 3.95
    }
  ],
  "experience": [
    {
      "company": "National Museum",
      "title": "Lead Researcher",
      "start_date": "September 2014",
      "end_date": "Present",
      "bullets": [
        "Led team in digitizing historical artifacts. Catalog is available online at my github repository https://github.com/dianaprince/museum-digital-catalog.",
        "Published 12 research papers on antiquity archiving."
      ]
    }
  ],
  "projects": [],
  "skills": [
    "Archiving",
    "Research",
    "SQL",
    "Python"
  ],
  "open_source_contributions": []
}