{
  "name": "Charlie Brown",
  "contact": {
    "email": "charlie.brown@example.com",
    "phone": "555-0400",
    "links": [
      "https://github.com/charliebrown"
    ]
  },
  "education": [
    {
      "institution": "UC Berkeley",
      "degree": "BS (Bachelor of Science)",
      "field": "Computer Science",
      "start_date": "2016-09",
      "end_date": "2020-05",
      "gpa": 3.7
    }
  ],
  "experience": [
    {
      "company": "Search Corp",
      "title": "Software Engineer Intern",
      "start_date": "June 2019",
      "end_date": "",
      "bullets": [
        "Built a core company project: the 'Kite-Tracker' tool"
      ]
    }
  ],
  "projects": [
    {
      "name": "Kite-Tracker",
      "description": "An analytics dashboard for tracking and mapping weather balloon trajectories.",
      "tech_stack": [
        "React",
        "TypeScript",
        "Node.js"
      ],
      "links": [
        "https://github.com/charliebrown/kite-tracker"
      ]
    }
  ],
  "skills": [
    "React",
    "TypeScript",
    "Node.js",
    "Python"
  ],
  "open_source_contributions": []
}