{
  "name": "Diana Prince",
  "contact": {
    "email": "diana.prince@example.com",
    "phone": "555-0500",
    "links": [
      "https://github.com/dianaprince"
    ]
  },
  "education": [
    {
      "institution": "Oxford University",
      "degree": "Doctor of Philosophy",
      "field": "Archaeology",
      "start_date": "2010-10",
      "end_date": "2014-06",
      "gpa": 3.95
    }
  ],
  "experience": [
    {
      "company": "National Museum",
      "title": "Lead Researcher",
      "start_date": "September 2014",
      "end_date": "",
      "bullets": [
        "Led team in digitizing historical artifacts and creating an online catalog",
        "Published 12 research papers on antiquity archiving"
      ]
    }
  ],
  "projects": [
    {
      "name": "Digitizing Historical Artifacts",
      "description": "Led team in digitizing historical artifacts and catalog is available online at my github repository.",
      "tech_stack": [
        "Python",
        "SQL"
      ],
      "links": [
        "https://github.com/dianaprince/museum-digital-catalog"
      ]
    }
  ],
  "skills": [
    "Research",
    "SQL",
    "Python"
  ],
  "open_source_contributions": []
}