{
  "name": "Bob Vance",
  "contact": {
    "email": "bob.vance@example.com",
    "phone": "555-0300"
  },
  "education": [
    {
      "institution": "University of Pennsylvania",
      "degree": "Bachelor of Arts in Economics",
      "field": "Economics",
      "start_date": "September 2015",
      "end_date": "May 2019",
      "gpa": 3.6
    }
  ],
  "experience": [
    {
      "company": "Blue Widgets Inc",
      "title": "Financial Analyst",
      "start_date": "June 2019",
      "end_date": "Present"
    },
    {
      "company": "Scranton Consulting",
      "title": "Independent Consultant",
      "start_date": "January 2021",
      "end_date": "Present"
    }
  ],
  "projects": [],
  "skills": [
    "Excel",
    "Financial Modeling",
    "Consulting",
    "SQL"
  ],
  "open_source_contributions": []
}