{
  "name": "Oscar Martinez",
  "contact": {
    "email": "oscar.m@example.com",
    "phone": "555-1500",
    "links": [
      "https://github.com/omartinez",
      "https://linkedin.com/in/oscarmartinez"
    ]
  },
  "education": [
    {
      "institution": "Penn State University",
      "degree": "MBA",
      "field": "Finance",
      "start_date": "September 1993",
      "end_date": "June 1995",
      "gpa": 3.85
    }
  ],
  "experience": [
    {
      "company": "Dunder Mifflin",
      "title": "Senior Accountant",
      "start_date": "August 1995",
      "end_date": "Present",
      "bullets": [
        "Audited branch cash balances and managed internal ledgers.",
        "Designed 'Ledger-Audit', an automated tool for transaction verification."
      ]
    },
    {
      "company": "Scranton Coalition",
      "title": "Treasurer",
      "start_date": "January 2005",
      "end_date": "Present",
      "bullets": [
        "Managed financial reporting and local tax declarations.",
        "Applied Ledger-Audit tools for coalition balances."
      ]
    }
  ],
  "projects": [
    {
      "name": "Ledger-Audit",
      "description": "Automated ledger checking scripts in Python.",
      "tech_stack": [
        "Python",
        "Pandas"
      ],
      "links": [
        "https://github.com/omartinez/ledger-audit"
      ]
    }
  ],
  "skills": [
    "Accounting",
    "Python",
    "Pandas",
    "Auditing"
  ],
  "open_source_contributions": []
}