{
  "name": "Fiona Gallagher",
  "contact": {
    "email": "fiona.g@example.com",
    "phone": "555-0700",
    "links": [
      "https://linkedin.com/in/fionag",
      "https://linkedin.com/in/fionag"
    ]
  },
  "education": [
    {
      "institution": "City College of Chicago",
      "degree": "Associate Degree",
      "field": "Business Administration",
      "start_date": "2012-09",
      "end_date": "2014-06",
      "gpa": 3.4
    }
  ],
  "experience": [
    {
      "company": "Patsys Pies",
      "title": "Manager",
      "start_date": "July 2014",
      "end_date": "",
      "bullets": [
        "Implemented 'Pie-Tracker' Excel automation macro project"
      ]
    }
  ],
  "projects": [
    {
      "name": "Pie-Tracker",
      "description": "An Excel automation macro project.",
      "tech_stack": [
        "Excel"
      ],
      "links": [
        "https://github.com/fionag/pie-tracker"
      ]
    }
  ],
  "skills": [
    "Excel",
    "Accounting",
    "Pie-Tracker"
  ],
  "open_source_contributions": []
}