{
  "name": "Harry Potter",
  "contact": {
    "email": "harry.potter@example.com",
    "phone": "555-0900"
  },
  "education": [
    {
      "institution": "Hogwarts School",
      "degree": "N.E.W.T. in Defense Against the Dark Arts",
      "field": "Defense Against the Dark Arts",
      "start_date": "September 1991",
      "end_date": "June 1998"
    }
  ],
  "experience": [
    {
      "company": "Ministry of Magic",
      "title": "Auror",
      "start_date": "July 1998",
      "end_date": "Present"
    },
    {
      "company": "Hogwarts School",
      "title": "Guest Instructor",
      "start_date": "September 2002",
      "end_date": "June 2005"
    }
  ],
  "projects": [
    {
      "name": "Wand-Builder",
      "description": "Simulation software for testing wand core properties under various conditions.",
      "tech_stack": [
        "Python",
        "Tkinter"
      ],
      "links": [
        "https://github.com/hpotter/wand-builder"
      ]
    }
  ],
  "skills": [
    "Defense, Leadership, Teaching"
  ],
  "open_source_contributions": []
}