{
  "name": "Iris West",
  "contact": {
    "email": "iris.west@example.com",
    "phone": "555-1000",
    "links": [
      "https://linkedin.com/in/iriswest"
    ]
  },
  "education": [
    {
      "institution": "Central City University",
      "degree": "BA in Journalism",
      "field": "",
      "start_date": "September 2011",
      "end_date": "June 2015",
      "gpa": 3.7
    }
  ],
  "experience": [
    {
      "company": "Central City Picture News",
      "title": "Investigative Reporter",
      "start_date": "July 2015",
      "end_date": "Present",
      "bullets": [
        "Conducted interviews and wrote front-page articles on city incidents.",
        "Managed the digital newsroom archive transition."
      ]
    }
  ],
  "projects": [],
  "skills": [
    "Writing",
    "Editing",
    "SEO",
    "Research"
  ],
  "open_source_contributions": []
}